{
  "schemaVersion": "1",
  "profile": "engineering",
  "generator": "change-brief-collect",
  "headBranch": "feat/tax",
  "headSha": "9f2c1a4e77d0a3b1c2d3e4f5a6b7c8d9e0f1a2b3",
  "detachedHead": false,
  "baseBranch": "main",
  "baseRef": "origin/main",
  "baseSha": "6a1b2c3d4e5f60718293a4b5c6d7e8f901234567",
  "mergeBaseSha": "aabbccddeeff00112233445566778899aabbccdd",
  "baseAheadCount": 0,
  "workingTreeDirty": false,
  "empty": false,
  "summaryHint": null,
  "totalAdded": 24,
  "totalDeleted": 1,
  "files": [
    { "path": "src/calc.js", "status": "M", "added": 6, "deleted": 0, "binary": false },
    { "path": "src/pricing.ts", "status": "M", "added": 2, "deleted": 1, "binary": false },
    { "path": "src/money.ts", "status": "A", "added": 5, "deleted": 0, "binary": false },
    { "path": "src/格式化.ts", "status": "A", "added": 2, "deleted": 0, "binary": false },
    { "path": "tests/calc.test.ts", "status": "A", "added": 9, "deleted": 0, "binary": false }
  ],
  "topDirs": [
    { "dir": "src", "fileCount": 4, "added": 15, "deleted": 1 },
    { "dir": "tests", "fileCount": 1, "added": 9, "deleted": 0 }
  ],
  "commits": [
    { "hash": "9f2c1a4e", "author": "Ada Chen", "dateIso": "2025-06-10T09:12:00Z", "subject": "feat: add applyTax with cent rounding" },
    { "hash": "3bd08c11", "author": "Ada Chen", "dateIso": "2025-06-11T14:03:00Z", "subject": "fix: apply tax in pricing total" }
  ],
  "changedLines": {
    "src/calc.js": {
      "added": [
        { "line": 8, "text": "function applyTax(amount, rate) {" },
        { "line": 9, "text": "  const raw = amount * rate;" },
        { "line": 10, "text": "  console.log('tax for amount', amount, '=', raw);" },
        { "line": 11, "text": "  return Math.round(raw * 100) / 100;" },
        { "line": 12, "text": "}" },
        { "line": 13, "text": "module.exports = { applyTax };" }
      ],
      "deleted": [],
      "truncated": false
    },
    "src/pricing.ts": {
      "added": [
        { "line": 6, "text": "  const total = subtotal + applyTax(subtotal, TAX_RATE);" },
        { "line": 7, "text": "  // tax now applied at checkout" }
      ],
      "deleted": [
        { "line": 5, "text": "  const total = subtotal;" }
      ],
      "truncated": false
    },
    "src/money.ts": {
      "added": [
        { "line": 1, "text": "// money helpers" },
        { "line": 2, "text": "export function toCents(v) { return Math.round(v * 100); }" },
        { "line": 3, "text": "export function fromCents(c) { return c / 100; }" },
        { "line": 4, "text": "export const ZERO = toCents(0);" },
        { "line": 5, "text": "// negative amounts handled by callers" }
      ],
      "deleted": [],
      "truncated": false
    },
    "src/格式化.ts": {
      "added": [
        { "line": 1, "text": "// 金额格式化" },
        { "line": 2, "text": "export const fmt = (v) => v.toFixed(2);" }
      ],
      "deleted": [],
      "truncated": false
    },
    "tests/calc.test.ts": {
      "added": [
        { "line": 1, "text": "const { applyTax } = require('../src/calc');" },
        { "line": 2, "text": "describe('applyTax', () => {" },
        { "line": 3, "text": "  it('rounds to cents', () => {" },
        { "line": 4, "text": "    expect(applyTax(100, 0.1)).toBe(10);" },
        { "line": 5, "text": "  });" },
        { "line": 6, "text": "  it('keeps cent precision on repeating rates', () => {" },
        { "line": 7, "text": "    expect(applyTax(19.99, 1 / 3)).toBe(6.66);" },
        { "line": 8, "text": "  });" },
        { "line": 9, "text": "});" }
      ],
      "deleted": [],
      "truncated": false
    }
  },
  "sensitiveTouch": {},
  "contentOmitted": {},
  "repoContext": null
}
